{
  "schema_version": "source.v0.1",
  "id": "SOURCE-CAMBRIDGE-MARK-DATE",
  "source_type": "academic_article",
  "title": "The Date of the Markan Gospel",
  "creator": "S. G. F. Brandon",
  "publisher": "New Testament Studies / Cambridge University Press",
  "date": "1961",
  "languages": [
    "en"
  ],
  "locators": [
    {
      "type": "url",
      "value": "https://www.cambridge.org/core/journals/new-testament-studies/article/abs/date-of-the-markan-gospel/B34650230D991C2B56A96866131DC994",
      "accessed_at": "2026-09-07T21:28:21Z"
    },
    {
      "type": "doi",
      "value": "10.1017/S0028688500005336",
      "accessed_at": "2026-09-07T21:28:21Z"
    }
  ],
  "authority": "academic",
  "reliability": {
    "score": 0.93,
    "notes": "Scholarly discussion of the dating problem; useful as context rather than a final universal date verdict."
  },
  "rights": null,
  "notes": "Documents the long-standing scholarly placement of Mark around 65–75 CE and the importance of the 70 CE destruction to the dating debate.",
  "status": "active",
  "metadata": {
    "created_at": "2026-09-07T21:28:21Z",
    "updated_at": "2026-09-07T21:28:21Z"
  }
}
