{
  "schema_version": "source.v0.1",
  "id": "SOURCE-ORACC-INANA-ISHTAR",
  "source_type": "reference_work",
  "title": "Ancient Mesopotamian Gods and Goddesses — Inana/Ištar (goddess)",
  "creator": "Ancient Mesopotamian Gods and Goddesses project",
  "publisher": "ORACC / University of Pennsylvania",
  "date": null,
  "languages": [
    "English"
  ],
  "locators": [
    {
      "type": "url",
      "value": "https://oracc.museum.upenn.edu/amgg/listofdeities/inanaitar/",
      "accessed_at": "2026-09-07T18:26:10Z"
    }
  ],
  "authority": "academic",
  "reliability": {
    "score": 0.96,
    "notes": "University-hosted specialist reference for deity identity, names, functions, and Mesopotamian context."
  },
  "rights": "See ORACC project terms.",
  "notes": "Context source only; textual claims about composition 1.4.1 are grounded primarily in ETCSL/CDLI.",
  "status": "active",
  "metadata": {
    "created_at": "2026-09-07T18:26:10Z",
    "updated_at": "2026-09-07T18:26:10Z"
  }
}
