{
  "schema_version": "source.v0.1",
  "id": "SOURCE-RGBL-WEB-MARK-13-2",
  "source_type": "primary_text",
  "title": "RGBL World English Bible Classic 2020 — Mark 13:2",
  "creator": "World English Bible / Rocksoul RGBL",
  "publisher": "rocksoul-rgbl canonical corpus",
  "date": "2020 stable edition",
  "languages": [
    "en"
  ],
  "locators": [
    {
      "type": "url",
      "value": "https://github.com/bjo163/rocksoul-rgbl/blob/main/datasets/web-classic-2020/data/core/resources/web-classic-2020.jsonl",
      "accessed_at": "2026-09-07T21:28:21Z"
    },
    {
      "type": "other",
      "value": "rgbl:mw:passage:web-classic:2020:mar:13:2",
      "accessed_at": "2026-09-07T21:28:21Z"
    }
  ],
  "authority": "primary",
  "reliability": {
    "score": 0.98,
    "notes": "Source-preserving English edition with provenance held by RGBL."
  },
  "rights": "Public-domain text; edition/trademark context is preserved by RGBL.",
  "notes": "English comparison witness for the same verse reference. The Greek SBLGNT expression remains separate.",
  "status": "active",
  "metadata": {
    "created_at": "2026-09-07T21:28:21Z",
    "updated_at": "2026-09-07T21:28:21Z"
  }
}
